review_date,review_rating,review_title,review_text,verified_purchase
2019-04-02,5,,I like all dove products and this body wash one of them it smells very amazing and moisturizing it an essential to have in the shower,False
2019-04-02,5,,This is my go to body wash. I have been using dove easily for like 10 years. It's great for sensitive skin. I love the scent and it's great at keeping your skin feeling hydrated. It doesn't strip your skin and make you feel overly dried out. I would definitely recommend this soap!,False
2019-04-02,5,,My doctor recommended this to me as an every day use and Im soooo glad she did. Ive been using Dove for years and Ive never thought twice about using a different brand. Love the way it smells and it keeps my skin moist just like the bottle says!,False
2019-04-02,5,Amazing,"This deodorant is amazing, the best I have every used, I would recommend it to anyone. And it’s gentle on my skin another bonus",True
2019-04-02,5,Bargain price!,"Bought this on sale and thought it was an absolute steal! 4x400ml for £9 - unbeatable! This has been used daily since purchase - Dec 18 and there is still 1/3 of the first bottle remaining. Don't think I'll need to purchase shampoo for quite some time at this rate. Smells great and leaves my hair (head & beard) feeling soft, fresh and clean. Lathers up really easily!",True
2019-04-02,5,Buy agen,Love this because it leaves my hair very smooth,True
2019-04-02,3,arrived in good time,seems watered down,True
2019-04-02,4,Great fragrance - fresh,Love this fragrance but it doesn't seem to last as long as other brands but absolutely value for money at this price for such a big bottle!,False
2019-04-02,5,Amazing,"This deodorant is amazing, the best I have every used, I would recommend it to anyone. And it’s gentle on my skin another bonus",True
2019-04-02,5,Bargain price!,"Bought this on sale and thought it was an absolute steal! 4x400ml for £9 - unbeatable! This has been used daily since purchase - Dec 18 and there is still 1/3 of the first bottle remaining. Don't think I'll need to purchase shampoo for quite some time at this rate. Smells great and leaves my hair (head & beard) feeling soft, fresh and clean. Lathers up really easily!",True
2019-04-02,5,Buy agen,Love this because it leaves my hair very smooth,True
2019-04-02,4,Still have these a few months on!,"I like the facial wipes for exfoliation, but wouldn’t choose them for removing makeup. They have lasted me almost four months, and I still have a pack left.",True
2019-04-24,5,Comfort Intense Laundry Conditioner Liquid,"Our household normally use comfort, however I hadn't used the 'Fresh Sky' scent before, which I must say is really nice! Just don't go sniffing directly from the bottle as it's concentrated, the scent is much more intense that it really is. The ultra concentrated allows for a much smaller bottle and you don't need to use as much in the washing machine either (just half a lid worth); the smaller bottle of course makes the carbon footprint smaller; in addition, the bottle is made from 100% recycled plastic which is a bonus, and both the bottle and lid can be recycled back. Only downside is the sleeve isn't, so do make sure you remove this before throwing the bottle in the recycling; hopefully they will work on making the whole thing recyclable in the future. All in all, good value for money and great scent (though the latter is subjective).",False
2019-04-02,5,Lovely smell from this,Love this fabric conditioner,True
2019-04-02,5,Not Pavlovs. It’s mine.,This stuff works. Unless you think by conditioner it means it’ll train your dog. It won’t. And it doesn’t ring like a bell. But it does leave your clothes softer and smelling fresher.,True
2019-04-03,4,,"Very good if you have dry skin. Its gentle on the skin and leaves it feeling clean and smelling very nice. Very basic body wash, does not harm your skin in any way like some body washes can and it nourishes the skin. Very good product to use",False
2019-04-03,4,,"Very good if you have dry skin. Its gentle on the skin and leaves it feeling clean and smelling very nice. Very basic body wash, does not harm your skin in any way like some body washes can and it nourishes the skin. Very good product to use",False
2019-04-07,5,Does the job,This product removes make up but does require some rubbing!,False
2019-04-03,4,Great for make up removal!,"I gave these wipes to my girlfriend who mentioned that they are good for taking make up off or just for morning hydration, and very gentle on the skin if you don't have make up on! My girlfriend is a fan of the simple range and this is one she will be getting again. [This review was collected as part of a promotion.]",False
2019-04-03,5,Delish,This is really lovely ice cream. Good price for tub size as well. None of our guests could believe it's vegan.,False
2019-04-03,5,Large Jar,"Watch out, I bought this when it was on offer, expecting a smaller jar to turn up. Good job we like mustard!",False
2019-04-03,5,Good hypoallergenic fabric conditioner,One of my favorite products and when you get delivered you don't have to carry the hefty thing home. That's a win-win in my books.,True
2019-04-03,5,Amazing flavour and delicious ice cream,"I'm not a big ice cream eater, but I love these, the combination of dark chocolate and the really nice raspberry sauce is AMAZING!!!! The ice cream is really creamy too.",False
2019-04-03,5,Super refreshing.,"Very citrus and refreshing, not so mini either. Lovely ice lollies, would highly recommend these and would definitely buy again.",False
2019-04-03,3,Sweet and sticky,"This is one of my favorite flavours of pot noodle, but I have gone off it a little recently. There are far better foods out there, but the pure convenience of a pot noodle cannot be denied.",True
2019-04-03,5,Fab,Fab,True
2019-04-03,2,Not skin friendly,"No matter what ingredient they have put in for exfoliation, the tissue is thick and rough and my face was so painful during each wipe and turned all red eventually. It is not a pleasure at all and is not comfortable to use. I should buy one pack in store and try first before order this 6 packs in a box. I personally don't like it. If anyone out there is using this happily can contact me to take away the rest.",True
2019-04-03,5,great product,"great product, works really well",True
2019-04-20,5,Lasts ages,We use these all the time but used to buy the tins singularly from a supermarket for over £4 each. So 3 for £9 is great.,True
2019-04-11,3,Disappointed,Bit greasy the product and only received 2 so didn’t get the 3rd,True
2019-04-07,5,Class,Really good value,True
2019-04-18,5,Actually holds,"I have thick hair and have difficulty finding a product that will hold without falling flat. Applying these to dry hair I've found using a moderate amount of the clay my hair will hold and have the right shine. The product is cheap, smells good and does the job, I definitely recommend it.",True
2019-04-03,5,Fab,Fab,True
2019-04-03,5,Great,Great price,True
2019-04-03,5,Thank you god bless,Good for the money I get more for that money,True
2019-04-03,5,Smells nice,Smells great and good price if you can get for £6,True
2019-04-04,5,Best stock cubes,I use these all the time have tried others but there are a winner,False
2019-04-04,1,Diabetes bomb,"Its just too sweet to eat: caramel, marshmallow, chocolate, etc, look at them. Its literally a calorie bomb!!! And the ingredients just melting together, too sweet and gross. Im gonna throw up after eating this.",False
2019-04-04,5,Fast delivery,A+,True
2019-04-04,5,My hair feels great,Love the smell and leaves my hair feeling great after styling,True
2019-04-04,5,Handy and convenient,Not my cup of tea but the old man loves them so they have to be a 5* because he has at least 2 every week at lunch time. They make a nice convenient lunch and he likes the flavour. We have gone back to the normal size one's. There is less difference between them than one might imagine and they King is usually much more expensive. These are 90g the King 114 grams.,False
2019-04-04,5,Fast delivery,A+,True
2019-04-04,5,Happy customer,Neatly packaged and quick delivery. I like everything about my item. Thank you,True
2019-05-04,4,Miss,This is one my favourite scents however I\u2019ve recently noticed that the conditioner is no longer pink in colour and the scent has dramatically changed.. can someone please explain.. disappointing,False
2019-05-04,5,amazing!!,amazing!cant rate it enough got it as a gift and can\u2019t stop smelling it the scent is absolutely amazing the exfoliate itself is amazing my skin after the use feels so soft just can\u2019t stop using it!wont use any other skin brand!x,False
2019-04-05,5,Great product,Im very happy with this purchase. Would definitely recommend for my friends and family,False
2019-04-05,1,May as well use vaseline,"Awful product, no hold, leaves hair flat and greasy, doesn't dry.",False
2019-04-05,1,Everything ends,"I bought this to wash my clothes, however! You need a washing machine as well! Should say so in the description",True
2019-04-05,4,Husband hated fragrance.,Despite using sure for years he does not like this one.,True
2019-04-05,5,Great product,Beautiful smell and love how it the scent lasts for ages!,True
2019-04-06,5,Great value,Really impressed with this product. Smells so nice and clothes smell fresh weeks after being washed.,True
2019-04-05,5,Excellent value for Money,fast delivery Good value for money,True
2019-04-05,5,kitchen,great great will buy again,True
2019-04-06,5,Excellent product!,"I suffer from dry skin on various parts of my face, and I have tried many other products, but nothing ever seemed to work. My make-up would sit horribly on my face, it looked blotchy due to the dryness. I found this and decided to give it a go, and it was the best decision I have made. I have only been using it a few weeks, but already there has been great improvement in my skin. My skin feels so refreshed! I would definitely reccommend this product!",False
2019-04-06,2,Good but leaky,Good product that I have used before Came in wrapping all around but one leaked,True
2019-04-06,5,Yep,Smells lovely and fresh,True
2019-04-07,5,New holy grail!,"This stuff is absolutely amazing. I have been using it for about three weeks and it has completely transformed my skin. It2019s made it so soft, hydrated and smooth. I used to always struggle with the skin on and around my nose, it was always very dry and extremely dehydrated no matter what I tried and this is the only cream that has completely sorted them issues out. My make up now sits so nicely over my nose and the rest of my skin too. I purchased this sleeping cream and also the day version but I much prefer using this one day and night as the night one is that little bit more moisturising!",False
2019-04-07,5,Happy,For my hair,True
2019-04-07,5,Good,Good,True
2019-04-07,5,Will use again and again!!,"I’ve got mrs hinch to thank for the reason that I tried this and wow I’m glad I did. This with a non scratch scouring pad (or the Minky sponge) leaves me oven, hob, taps and sink and also my shower screen gleaming!! Amazing",True
2019-04-07,5,good,"Like most people I always forget to leave positive feedback, but always quick to leave negative feedback. This time I make a point! Item as described. Very happy with the service, thank you very much.",True
2019-04-07,5,Good value - subtle fragrance,"Great value when compares to what you get charged at the supermarket. Softens clothes, is kind on the skin and the fragrance isn't overbearing like some fabric conditioners.",True
2019-04-07,5,Love comfort,We only use comfort in our house to Buy this bigger one on a regular basis when on special,True
2019-04-07,4,Okay,4 stars purely because it leaves a smear on my white kitchen tiles but it does clean them well,False
2019-04-07,5,Use this every time!,I've used other heat protection products and they've left my hair sticky or greasy. I love this spray!! Love how soft my hair feels after using it too.,True
2019-05-01,1,may contain milk??!!!,a little confused why so many people are saying these are vegan when the ingredients say these MAY contain milk. May?! what's that about? if the makers of these do not know who does? really disappointing for those who cannot take that risk,False
2019-04-08,5,Amazing!!,"I used this in Gran Canaria in 25\u00B0C heat and it protected my face from 8am until 5pm, when i washed it off. It isn't greasy at all and dries with in minutes. Doesn't leave a shiny look and feels like it's moisturising whilst protecting the skin at the same time! I used it every day for 2 weeks and there isn't still loads left in the bottle. Would recommend to anyone!!!! Amazing.",False
2019-04-08,2,Disappointing new fragrance,"I've used this product for years and it's always worked well. I recently bought it and it had a new fragrance, which wasn't made obvious and I didn't really like. It doesn't offer me the same sweat protection. Had I known I wouldn't have bought it",False
2019-04-08,1,Oh God! The smell.....,"I have no idea how well it tans as yet. I am writing this at 4am, I put it on after my shower yesterday evening and the stink has woken me up and given me an absolutely horrific headache. Desperate to wash it off but I'm afraid of disturbing the kids. Cheers Dove!!",False
2019-04-08,2,Disappointing new fragrance,"I've used this product for years and it's always worked well. I recently bought it and it had a new fragrance, which wasn't made obvious and I didn't really like. It doesn't offer me the same sweat protection. Had I known I wouldn't have bought it",False
2019-04-08,2,Disappointing new fragrance,"I've used this product for years and it's always worked well. I recently bought it and it had a new fragrance, which wasn't made obvious and I didn't really like. It doesn't offer me the same sweat protection. Had I known I wouldn't have bought it",False
2019-04-08,5,Use a little,"Lovely smell. Softens clothes. The whole range of Comfort is good. However, I think we all use too much product. The fragrance is strong and the consistency of the conditioner is reasonably thick.I now use half as much as I previously used. One third to half a cap is quite enough for a full wash load to soften and produce amazing scent. And softens clothes admirably. We don't need an overpowering blast of perfume, a subtle whiff is lovely. By using less, we are doing our small bit to save the planet through pollution. We are also saving money as I've noticed that a bottle of softener lasts twice as long. Its a win win!",False
2019-04-08,5,Not a bad price and delivery free and quick,Best mayo. What else,True
2019-04-08,5,Smells lovely,What can you say but it's makes your clothes smell nice,True
2019-04-06,5,Fabric softener,Fit for purpose,True
2019-04-08,5,Good,Good,True
2019-04-08,5,Great bargain,Good washing capsules.The smell is very nice.,True
2019-04-07,5,Very good!,Better than most similar products and second to none.,True
2019-04-07,5,Easy to use value,Easy to use great value on subscription,True
2019-04-06,5,Lovely,Love this washing powder,True
2019-04-08,5,Washes well,"Does what it says on the label, washes well",True
2019-04-07,5,Easy to use value,Easy to use great value on subscription,True
2019-04-06,5,Lovely,Love this washing powder,True
2019-04-08,5,Great bargain,Good washing capsules.The smell is very nice.,True
2019-04-08,5,Washes well,"Does what it says on the label, washes well",True
2019-04-07,5,Very good!,Better than most similar products and second to none.,True
2019-04-08,5,Great bargain,Good washing capsules.The smell is very nice.,True
2019-04-08,5,Washes well,"Does what it says on the label, washes well",True
2019-04-07,5,Very good!,Better than most similar products and second to none.,True
2019-04-07,5,Easy to use value,Easy to use great value on subscription,True
2019-04-06,5,Lovely,Love this washing powder,True
2019-04-08,5,Great bargain,Good washing capsules.The smell is very nice.,True
2019-04-07,5,Easy to use value,Easy to use great value on subscription,True
2019-04-06,5,Lovely,Love this washing powder,True
2019-04-08,5,Washes well,"Does what it says on the label, washes well",True
2019-04-07,5,Very good!,Better than most similar products and second to none.,True
2019-04-08,5,5 stars great product,great price love this Fabric Conditioner,True
2019-04-07,5,Fantastic,Quick postage and great product,True
2019-04-07,5,Good,I don't smell anymore,True
2019-04-06,2,Good but leaky,Good product that I have used before Came in wrapping all around but one leaked,True
2019-04-06,5,Must have!,"Smells beautiful, fragrance lasts for weeks after washing. Great value, I’ve subscribed to this product.",True
2019-04-07,5,good,"Like most people I always forget to leave positive feedback, but always quick to leave negative feedback. This time I make a point! Item as described. Very happy with the service, thank you very much.",True
2019-04-09,1,Not Icecream,Binned It.,False
2019-04-23,5,Cured my acne!!,About two weeks after using this my bad cystic acne started to fade by the time i finished the bottle all my acne was gone.i thought i was just missing toner in my skin care so i started using a garnier one i had from a set .One week later my acne comes back so im back to using simple and my acne is fading again.i will never stop using this,False
2019-05-08,1,Horribly Drying,"I bought this a couple of months ago along with the cleanser and moisturiser as i have spot prone, oily skin and occasional issues with dermatitis around my eyes. This was the worst mistake ever. I thought I was crazy as Simple is supposed to be gentle on the skin but after using this toner it has dried my skin out and bought the dermatitis back around my eyes so they are very red, the skin flaky and sore in places. At first i didn't think it was the toner but after two months of elimination it is definitely the toner drying out my skin. I would not recommend this product at all.",False
2019-04-09,2,No nutritional information,I'm a diabetic and wanted to find out the carbohydrate content. I could not find ANY nutritional information whatsoever. Badly managed Walls...,False
2019-04-09,5,Give this a try !,"My girls are so picky about what they wash and condition their hair with and they go through a tonne of the stuff with being teens. So I thought I would try this. Excellent price. Well they were delighted with the results. Soft, stinky , silky and smooth hair. One has chemically treated hair as well. This lead me to have a try as mine is bleached and toned. Wow. I spend a fortune on shampoos and conditioners. Well you think you need to when you do on your hair. Not any more. This is great. I have it on subscribe and save feature now and saving us by not buying over priced products.",True
2019-04-09,5,Smells devine,The smell in clothes is so lovely and it last long.you dont have to use a lot aswell.would definately buy again and recommend to others.,False
2019-04-09,5,Brilliant value bundle,I normally buy my washing detergents in shops as I like to see what’s on offer etc... I had run out of washing liquid and fabric conditioner and wasn’t able to get to the shops due to a broken ankle. I came across this bundle as decided to give it a try as I as desperate for washing stuff. This bundle is a brilliant buy and very good value for money. I would highly recommend. However the fabric conditioner did seem to clog up the drawer though - this has never happened with the normal fabric conditioner I use.,True
2019-04-09,5,Give this a try !,"My girls are so picky about what they wash and condition their hair with and they go through a tonne of the stuff with being teens. So I thought I would try this. Excellent price. Well they were delighted with the results. Soft, stinky , silky and smooth hair. One has chemically treated hair as well. This lead me to have a try as mine is bleached and toned. Wow. I spend a fortune on shampoos and conditioners. Well you think you need to when you do on your hair. Not any more. This is great. I have it on subscribe and save feature now and saving us by not buying over priced products.",True
2019-04-09,5,Great smell....,"Love this specific version from Comfort. Really subtle and gentle smell that does not overpower the clothes, but you still know it is there.",True
2019-04-09,5,Really good tablets,"I have been converted to these by my friend. Tried a few times and cannot live without them now. Really fresh, yet mild smell to the clothes. Nicely removes all the stains of a messy 6 year old too!",True
2019-04-09,5,Really good tablets,"I have been converted to these by my friend. Tried a few times and cannot live without them now. Really fresh, yet mild smell to the clothes. Nicely removes all the stains of a messy 6 year old too!",True
2019-04-09,5,Really good tablets,"I have been converted to these by my friend. Tried a few times and cannot live without them now. Really fresh, yet mild smell to the clothes. Nicely removes all the stains of a messy 6 year old too!",True
2019-04-09,5,Really good tablets,"I have been converted to these by my friend. Tried a few times and cannot live without them now. Really fresh, yet mild smell to the clothes. Nicely removes all the stains of a messy 6 year old too!",True
2019-04-09,5,5 stars,"Fantastic value, ordered Sunday was delivered Monday..thanks so much!",True
2019-04-09,5,5 stars,smell good and make my clothes more soft,True
2019-04-30,3,Good lotion bad pump,"Lotion works pretty good however 8 pumps into a 20.3 oz bottle and the 201Csmart pump201D stopped working. They2019ve designed the bottle so that you can2019t screw the pump off, like we2019ve all done in the past to get the last of the lotion out. I was determined to not loose a entire bottle of lotion so I had to cut the top off with a box knife. Word to the wise, advoid the smart pump!",False
2019-04-14,2,Great Lotion Terrible Dispenser Dedign,The pump design on the large bottle is horrible. It is impossible to determine which end the lotion will come out by looking at the pump. How many carpets and pieces of furniture are being ruined by the pump design.,False
2019-04-25,2,Love the lotion.....hate the new smart pump!,"I can't believe you can't unscrew the top to get to the last of the lotion! I have 2\"" of lotion in the bottle that I can't get to! What a waste of money. Will be switching body lotions with my next purchase.",False
2019-04-10,5,Good,good,False
2019-04-10,4,Great,"Great soap, always lovely",True
2019-04-19,5,good for adults,"my daughter had allergies, she could not stand this one",True
2019-04-12,5,Great value - recommended,Great value and works well.,True
2019-04-24,5,The value was unbelievable,"Fantastic, Amazon 100% ther",False
2019-04-10,5,Great value and lasts ages.,Great value & delivery - perfect for anyone who does washing on a daily basis like we do - lasts ages and cheaper than buying multiple bottles in the supermarket. Smells lovely to!,True
2019-04-10,5,Excellent!,A lot of people are complaining this doesn't have a seal. Neither does the one you buy at Morrisons. These aren't required to have a seal on them. Great price and great product. It works well and smells good. Will be buying again.,True
2019-04-10,5,Brilliant !,Get these delivered regularly - makes it a lot easier than lugging all the heavy stuff home from the shop. Brilliant !,True
2019-04-10,5,Brilliant !,Get these delivered regularly - makes it a lot easier than lugging all the heavy stuff home from the shop. Brilliant !,True
2019-04-10,5,Brilliant !,Get these delivered regularly - makes it a lot easier than lugging all the heavy stuff home from the shop. Brilliant !,True
2019-04-10,5,Smells gorgeous,Great price and fast delivery,True
2019-04-10,2,Did not taste the same as the ones from my local Tesco,"The product delivered to me would not soften properly and tasted inferior to the ones I buy at Tesco. I had to put the pots in the microwave to get the noodles to soften up a little, and then leave them for several minutes. Will not buy again.",True
2019-04-10,5,Brilliant,Brilliant,True
2019-04-10,2,Did not taste the same as the ones from my local Tesco,"The product delivered to me would not soften properly and tasted inferior to the ones I buy at Tesco. I had to put the pots in the microwave to get the noodles to soften up a little, and then leave them for several minutes. Will not buy again.",True
2019-04-10,5,Brilliant !,Get these delivered regularly - makes it a lot easier than lugging all the heavy stuff home from the shop. Brilliant !,True
2019-04-10,2,cheap tasting,Not much flavour of praline at all. Very cheap taste and texture ice cream with cheap tasting choc covering. Also it tasted much more like dark chocolate than of milk and I am not really a fan of that.,False
2019-04-11,5,,Fav love it always use it xxxx makes my hair so soft n smooth,False
2019-04-11,5,Love it!,"So many uses, on buttered toast, in soups and stews, on roast potatoes.... a handy little tip.... when the jar is nearly empty, store the jar on its side, (there is a little flat bit on the side of the jar) and you can get that last bit out easily.",False
2019-04-11,5,,Love love love love this flavour. This is one of my favourites. Nice and spicy.,False
2019-04-11,5,Fabulous,I love this. It cleans and exfoliates beautifully without leaving my skin red and sore like some do. And it feels supersoft and refreshed. Used twice a week it keeps my skin looking and feeling clean and fresh.,False
2019-04-11,5,Value everyday shampoo,Value. Great for everyday use.,True
2019-04-11,5,Great,I have been using this deodorant for years and find it’s incredibly effective and long lasting! The only one I use.,True
2019-04-11,5,It's shampoo. Review unnecessary XD,It's shampoo. It's cheaper than in the shops. What more is there to say? XD,True
