review_date,review_rating,review_title,review_text,verified_purchase
2019-01-01,5,Dove Men’s + Deodorant,"As you get older, you know what you like and what is suitable for your body. I like all Dove products. Gives you that fresh all over, wide awake feeling and no dandruff or flakey skin. No smelly a/pits!",True
2019-01-02,5,Great for a marmite lover!,"Three gigantic marmite jars that will last probably a whole life! What else would you possibly wish for? Order came in time, when mentioned, safely packed. Very happy with it.",True
2019-01-02,4,Vitamin B12.,Excellent,True
2019-01-02,5,A Very Handy Flavour Top - Up to Keep In The Cupboard.,A great flavour top - up for slow cooking.,True
2019-01-02,5,Very handy,Does what is says it does,False
2019-01-02,4,Vitamin B12.,Excellent,True
2019-01-02,5,Great for a marmite lover!,"Three gigantic marmite jars that will last probably a whole life! What else would you possibly wish for? Order came in time, when mentioned, safely packed. Very happy with it.",True
2019-01-02,5,A Very Handy Flavour Top - Up to Keep In The Cupboard.,A great flavour top - up for slow cooking.,True
2019-01-05,4,nearly 5 star,Excellent item.Good for men,False
2019-01-06,5,Good,Thank you I’m very happy,True
2019-01-06,5,Good,Thank you I’m very happy,True
2019-01-07,5,Deodorant,Beautiful,True
2019-01-09,5,Repeat purchase,Always buy. Big bottles,True
2019-01-02,5,Very handy,Does what is says it does,False
2019-01-02,5,Excellent on my badly treated hair,Always use this product on my heavily mistreated hair and it works wonders time after time,True
2019-01-12,5,Recommend,Great value,True
2019-01-02,5,Excellent on my badly treated hair,Always use this product on my heavily mistreated hair and it works wonders time after time,True
2019-01-13,5,Happy,"It’s not the one in the picture, but gets 5 stars because it’s the regular one I use and it’s awesome for people with dry skin.",True
2019-01-11,5,Really works,"Item as described, excellent quality, rapid delivery Great for skin irritations, redness, blemishes",True
2019-01-14,5,Lovely,Good body wash but not a very strong smell,True
2019-01-16,5,Toiletries,Great,True
2019-01-16,5,Toiletries,Great,True
2019-01-19,5,More for your money!,Worth it!,True
2019-01-20,5,Superb,I remember trying this at a friends house years ago. Now Ive been using it for about 3-months and its the only one Ill buy.,False
2019-01-03,5,Great,Great,True
2019-01-22,3,Pay a little more for a better antiperspirant,Not the best antiperspirant out there unless you like going to work with a snow drift under your arm.,True
2019-01-22,5,Smells lovely,Love this product,True
2019-01-22,5,Addicted,If I die eating one of these I\u2019ll die a very contented man. I love \u2018em,False
2019-01-25,5,Beautifully Moisturising,"I love this range of body lotions as they aren\u2019t greasy, are easy to apply and soak in quickly and leave my skin feeling super soft and moisturised. Great value for money and the scent is fresh and light, a great go to beauty essential in my bathroom cupboard. [This review was collected as part of a promotion.]",False
2019-01-26,5,A miracle in a bottle! Absolutely love this product!,"I suffer with dry sensitive skin and vaseline is one of very few products that doesn't make my skin flare up and itch like crazy!The first thing I noticed was the beautiful fresh smell that escaped as I lifted the cap, as I applied a drop to my skin I instantly felt a soothing relief and easily moisturised into my skin absorbing effortlessly and not at all greasy unlike alot of other moisturisers I've tried! I use this product every day and it has improved my dry skin condition massively couldn't recommend this product enough I absolutely love it! [This review was collected as part of a promotion.]",False
2019-01-03,5,"Lingering, comforting smell and cleans really well",Absolutely love this stuff ... leaves a lovely lingering fragrance that you can smell each time you open a wardrobe or clothes drawer ... gets everything clean really well too Reminds me of when I was a kid and Mum just put me in some freshly laundered clothes ... lovely,True
2019-01-04,5,Very happy with it,Very happy with it,True
2019-01-28,5,Perfect for cashmere sweaters and silk tops,I love that I now wash my cashmere sweaters at home. Saves me a lot of money compared to taking my clothes to the dry-cleaners every week. Very happy with my purchase,True
2019-01-28,5,Skin so soft.. highly recommend!,So prior to receiving this I had pretty rough elbows in particular and my skin feels dry. As a busy mum of two I admit I sometimes neglect myself.. some of you may empathise! But this product trial gave me the perfect opportunity to reconnect with myself and have a bit of \u201Cme time\u201D. So for 3 days after my baths / shower I smothered myself with this. I must admit the first time I put this on I wasn\u2019t sure about the smell. It\u2019s not offensive it\u2019s like a cucumber smell (although it\u2019s aloe) but I tend to smell of perfumes all the time.. however by day 3 I actually liked the smell. Application: it went on nicely not too thick and soaked in pretty quickly it didn\u2019t feel sticky. I always have my morning wash by 07:30 but even in the evening before bedtime my skin is feeling noticibly softer and my rough elbows gone. Verdict: thumbs up. Yes I will be continuing to use this thank you for a fab product trial and for introducing me to Vaseline Aloe! [This review was collected as part of a promotion.],False
2019-01-14,5,"As described, quick delivery",Happy with item,True
2019-01-01,5,Light as a feather,"I really like this. The texture is almost like a gel so it's really light and easily absorbed into my skin, leaving it feel soft and fresh, without any of the weight that some thicker creams have.I would buy it again. [This review was collected as part of a promotion.]",False
2019-01-30,5,Good,Smells nice,True
2019-01-01,5,Great.,A great deal on treseme shampoo giving a long lasting supply so you don’t need to keep buying more and very good price.,True
2019-01-14,5,"As described, quick delivery",Happy with item,True
2019-01-01,5,Dove Men’s + Deodorant,"As you get older, you know what you like and what is suitable for your body. I like all Dove products. Gives you that fresh all over, wide awake feeling and no dandruff or flakey skin. No smelly a/pits!",True
2019-01-02,5,Lenor,Great value,True
2019-01-04,5,Great price delivered to your door,Love this comfort,True
2019-01-01,1,yuck,Horrible.,False
2019-01-02,5,a great product,a great buy,True
2019-01-04,3,"Love the design of the container but it is heavily perfumed, not for me!","Love the container, easy to pour, but am refilling with A. Nother automatic liquid in future as it is very thick and gloopy (hard to be economical) and it is so scented you smell like it when wearing what you washed (which some may love but I do not!) -after 3 rinses!",True
2019-01-08,5,Great for darks,Washes sharks well,True
2019-01-27,5,excellent,excellent,True
2019-01-06,5,Good,Thank you I’m very happy,True
2019-01-02,5,Christmas smellies,Good pleasant smelling deoderant boys will love it at christmas.,True
2019-01-02,4,Good shampoo,delivered quickly and decent shampoo. only 4 star as one bottle was leaking when delivered,True
2019-01-02,5,Best Make-up remover product,"Have used a lot of make-up brands and in the past bought their more expensive make-up remover products, but none have ever removed mascara, eye-shadow, foundation bases etc as gently and as well as Simple Cleansing Lotion. Its consistency is not runny, you have to squeeze the bottle appropriately onto the cotton wool, which is ideal for controlling how much is dispensed. Also great for tidying up eyeliner or mascara errors when applied sparsely on a cotton wool bud. Always keep this now in my bathroom cabinet. Why pay more?",False
2019-01-02,5,can't beat it,not sure why the big jar costs more than double this size though!,False
2019-01-02,5,what a bargain,"Got this on offer for £6, clothes come out very soft, and smelling great. and It should last a long time too, its 100% genuine as well",True
2019-01-02,5,Great,"For £6 this is an amazing buy- lasted me months!, smelt amazing and my neighbour even asked me to buy her one!",True
2019-01-01,5,Lovely scent,"Great buy, smells gorgeous",True
2019-01-02,5,what a bargain,"Got this on offer for £6, clothes come out very soft, and smelling great. and It should last a long time too, its 100% genuine as well",True
2019-01-01,5,Lovely scent,"Great buy, smells gorgeous",True
2019-01-02,5,Great,"For £6 this is an amazing buy- lasted me months!, smelt amazing and my neighbour even asked me to buy her one!",True
2019-01-02,5,Texture,Texture liked.used for bath/shower,True
2019-01-14,5,super buy,shared with family,True
2019-01-06,5,We love the smell,We love it and even better when it’s on a deal,True
2019-01-04,5,Good seller,Great product!,True
2019-01-01,4,Not as advertised,"Bought items to give as gifts, it was advertised as Dove Moisturising Deeply Nourishing Body Wash but I received Dove idratante bagnodoccia di belleza, a language I cannot read. Even has a less distinct fragrance.",True
2019-01-02,5,Christmas smellies,Good pleasant smelling deoderant boys will love it at christmas.,True
2019-01-02,4,"Good price, good product","Good price and nice smell, not overpowering. Doesn’t leave white powdery mess like some anti perspirents do. Happy.",True
2019-01-01,5,Great.,A great deal on treseme shampoo giving a long lasting supply so you don’t need to keep buying more and very good price.,True
2019-01-02,4,Good shampoo,delivered quickly and decent shampoo. only 4 star as one bottle was leaking when delivered,True
2019-01-01,5,Good buy,"Good wipes, good buy",True
2019-01-02,5,Great for a marmite lover!,"Three gigantic marmite jars that will last probably a whole life! What else would you possibly wish for? Order came in time, when mentioned, safely packed. Very happy with it.",True
2019-01-02,5,a great product,a great buy,True
2019-01-01,5,"Smells great, misses well happy",Nice fragrance and it seems to last on the clothes.,True
2019-01-01,5,"Smells great, misses well happy",Nice fragrance and it seems to last on the clothes.,True
2019-01-01,5,"Smells great, misses well happy",Nice fragrance and it seems to last on the clothes.,True
2019-01-01,5,Dove Men’s + Deodorant,"As you get older, you know what you like and what is suitable for your body. I like all Dove products. Gives you that fresh all over, wide awake feeling and no dandruff or flakey skin. No smelly a/pits!",True
2019-01-02,4,Vitamin B12.,Excellent,True
2019-01-03,5,Leaves coloured hair shiny!,"I've been Using tresemme products for years. Previously the regular heat protection but after being recommended this one for colour treated hair gave it a go and Ive not looked back! Leaves my hair with a lovely shine, ive got dyed red hair so it can be hard to keep looking healthy. Seems to do a Good job with heat protection too. I only dry my hair, no straighteners or tongs but seems to keep the damage away",False
2019-01-03,5,Great Value,So much cheaper than in Boots. Great value!!!,True
2019-01-03,2,Nope,"I like the blue version but this is such an overpowering, awful smell it had to be binned.",False
2019-01-03,5,Great cleaning.... Great value pack of 3,"I like these, I use only one in the regular wash and everything comes clean. I'll use two if I load a 9kg wash or if I have a lot of white washing just to give an extra boost as the machine uses more water on these cycles. It's good value for money buying in a pack of three so these are a regular purchase for me.",True
2019-01-03,5,Comfort softener,Excellent value and you don't hav to carry it,True
2019-01-03,5,Price,Washing,True
2019-01-03,5,Comfort softener,Excellent value and you don't hav to carry it,True
2019-01-03,5,Great cleaning.... Great value pack of 3,"I like these, I use only one in the regular wash and everything comes clean. I'll use two if I load a 9kg wash or if I have a lot of white washing just to give an extra boost as the machine uses more water on these cycles. It's good value for money buying in a pack of three so these are a regular purchase for me.",True
2019-01-03,5,Great cleaning.... Great value pack of 3,"I like these, I use only one in the regular wash and everything comes clean. I'll use two if I load a 9kg wash or if I have a lot of white washing just to give an extra boost as the machine uses more water on these cycles. It's good value for money buying in a pack of three so these are a regular purchase for me.",True
2019-01-03,5,Great cleaning.... Great value pack of 3,"I like these, I use only one in the regular wash and everything comes clean. I'll use two if I load a 9kg wash or if I have a lot of white washing just to give an extra boost as the machine uses more water on these cycles. It's good value for money buying in a pack of three so these are a regular purchase for me.",True
2019-01-03,5,Best washing liquid,Lovely fresh smell,True
2019-01-03,5,happy,great item,True
2019-01-03,5,Noodle tastic,What’s not to like noodles that taste like spare ribs,True
2019-01-03,5,Great cleaning.... Great value pack of 3,"I like these, I use only one in the regular wash and everything comes clean. I'll use two if I load a 9kg wash or if I have a lot of white washing just to give an extra boost as the machine uses more water on these cycles. It's good value for money buying in a pack of three so these are a regular purchase for me.",True
2019-01-03,5,Great Value,So much cheaper than in Boots. Great value!!!,True
2019-01-03,5,Good if you have sensitive skin,"This is a good deodorant if you have easily irritated skin. It's like Dove soap in that it doesn't seem to irritate or dry out skin. I've used Dove soaps for quite a long time and this is certainly something which they are good for, this seems to be as good as all of them. It's main selling point, beyond being an effective 24 hour deodorant, is that it is not prone to marking your clothes. It certainly seems to work as far as that goes too, though we haven't been able to test on every single colour. Good though. Recommended.",False
2019-01-03,5,Price,Washing,True
2019-01-03,5,The real dove not a copy.,Great body wash. Cheap and fast delivery,True
2019-01-04,1,Why plastic?,"yet to try the taste but why, in this day and age, start producing what was perfect in glass bottles suddenly in plastic?",False
2019-01-04,1,Why plastic?,"yet to try the taste but why, in this day and age, start producing what was perfect in glass bottles suddenly in plastic?",False
2019-01-04,1,Angry and useless product,"Not even worth one star. Bring out a lot of white stuff, had high expectations but this product is a total failure and waste.",True
2019-01-04,5,Sure men,Bought this for my step dad,True
2019-01-04,5,Lynx effect? Definitely depends on the person,Love this on my OH. It smells so good on him but I hated it for years and still do on everyone else,True
2019-01-04,5,Good price,Great gift,True
2019-01-04,5,classic and the best,This is a classic and you know when its Hellmans Mayo. Cap stays so much cleaner than the jar. Tastes great with EVERYTHING!,False
2019-01-04,5,Cool,Cool,True
2019-01-04,5,Good seller,Great product!,True
2019-01-04,5,Cocoa Butter Skin,Absolutely great moistures for dry skin. Can complain. It’s smells great of the skin if you like that coca butter smell.,True
2019-01-04,5,Persil combo buy,Great package buy,True
2019-01-04,5,Good price,Great gift,True
2019-01-04,5,Lynx effect? Definitely depends on the person,Love this on my OH. It smells so good on him but I hated it for years and still do on everyone else,True
2019-01-04,5,Invisible and smell lovely,Works well and truly invisible,True
2019-01-04,1,Angry and useless product,"Not even worth one star. Bring out a lot of white stuff, had high expectations but this product is a total failure and waste.",True
2019-01-05,3,Well priced,Nice and cost effective,True
2019-01-05,5,Great,Great,True
2019-01-05,5,Great,Does exactly what it says my kitchen sink is always getting blocked and since I have put this down it has not been blocked for the last 2 months,True
2019-01-16,4,Pleasant scent,"This is my favourite scent from the intense range, smells lovely and lasts ages on my clothes. I do use more than the recommended amount otherwise the scent isn’t very strong, so it definitely doesn’t do 64 washes, probably half that.",False
2019-01-05,5,my favourite detergent,I find these to be the best for my laundry and a part of that includes only using one - not over dosing like I do with liquid or powders. smells great and washes well.,False
2019-01-05,5,gorgeous,And under 150 calories for a really big portion,False
2019-01-04,1,Why plastic?,"yet to try the taste but why, in this day and age, start producing what was perfect in glass bottles suddenly in plastic?",False
2019-01-04,1,Why plastic?,"yet to try the taste but why, in this day and age, start producing what was perfect in glass bottles suddenly in plastic?",False
2019-01-04,1,Why plastic?,"yet to try the taste but why, in this day and age, start producing what was perfect in glass bottles suddenly in plastic?",False
2019-01-04,1,Why plastic?,"yet to try the taste but why, in this day and age, start producing what was perfect in glass bottles suddenly in plastic?",False
2019-01-04,1,Why plastic?,"yet to try the taste but why, in this day and age, start producing what was perfect in glass bottles suddenly in plastic?",False
2019-01-06,4,A good product,The cream is very easy to apply and feels extremly cooling. It doesnt dry with any kind of sticky feeling to it. There is very little or no scent to it so the fact the the frangrance is fairly neutral is good. The cream spread and soaks in very easily [This review was collected as part of a promotion.],False
2019-01-04,5,Beautiful product,"Execellent product, made my skin feel silky smooth and extremely hydrated. Used it for a couple of weeks and my skin felt healthier, more hydrated and overall looked better. Would definitely recommend this product to a friend. [This review was collected as part of a promotion.]",False
2019-01-05,4,"Smooth, clear skin","This cream is light, odourless and leaves the skin feeling genuinely smooth, supple and refreshed. I use it as part of my nightly routine - applying it when going to bed after washing and drying my face. It is light enough not to clog the pores or feel sticky on the face, and in the morning my face always feels smooth and replenished. I have also tried using this cream during the daytime and, while it has all the benefits described above, it\u2019s not long-lasting enough in terms of the hydration it gives, meaning you often feel the need to reapply after a few hours. All in all a great overnight moisturiser if you have sensitive skin - it\u2019s unscented and it\u2019s really gentle on sore patches. [This review was collected as part of a promotion.]",False
2019-01-05,5,Fresh and Clean,Fresh and clean. Reliable delivery,True
2019-01-05,5,Great,Does exactly what it says my kitchen sink is always getting blocked and since I have put this down it has not been blocked for the last 2 months,True
2019-01-05,5,Great,Great,True
2019-01-05,3,Well priced,Nice and cost effective,True
2019-01-05,5,Clean and nice smelling,"Great combination, started using when my now 3yo was born and am still using it",True
2019-01-05,5,Came really quickly,Nice and fresh smelling products,True
2019-01-05,5,A perfect winter drink,"We all crave things that transport us back to more innocent times. For me Bovril is one of those things, from the gooey unctuousness of the tar black bovril overflowing from the spoon to the ""ding ding ding"" as I stir it in hot water to make it dissolve and the earthy, beefy smell with hints of celery and goodness knows what else. Sometimes you can get alcohol fatigue so Bovril is a great alternative to a nightcap or even mug of tea. I even go so far as to dissolve a pat of butter in it too for extra richness and within an hour I'm pretty much knocked out and sleep soundly until morning, warm and comforted. This pack will last me a long time I am sure, certainly 2 winters.",True
2019-01-05,5,Lovely conditioner,"Lovely, but can be bought cheaper in home bargains !",True
2019-01-05,1,Item damaged,Item was damaged and unable to pour without spillage.. have transferred to another bottle as unable to wait for replacement.,True
2019-01-05,5,Smell vey good.,Good price.,True
2019-01-05,1,Item damaged,Item was damaged and unable to pour without spillage.. have transferred to another bottle as unable to wait for replacement.,True
2019-01-05,5,Smell vey good.,Good price.,True
2019-01-05,5,Lovely conditioner,"Lovely, but can be bought cheaper in home bargains !",True
2019-01-05,5,Good price.,It came very fast.,True
2019-01-05,5,Good price.,It came very fast.,True
2019-01-05,5,Good price.,It came very fast.,True
2019-01-05,5,Good price.,It came very fast.,True
2019-01-05,5,Good price.,It came very fast.,True
2019-01-06,5,WHERE HAS IT GONE???,Hi Simple!This is my absolute must-have facial moisturiser and now I cannot find it in UK stores anywhere. Have you discontinued this product?! Please don't!,False
2019-01-06,1,new formula makes me constantly sneeze,Please go back to the old capsules - these new ones make our household suffer a terrible allergic reaction - constant hay fever!,False
2019-01-06,4,great smelling softener,Never usually use laundry softener but was very pleasantly surprised by the results with this product. Clothes smelt great and the smell lasted despite the childrens best efforts! And the clothes came out much softer. Think I am converted!,False
2019-02-03,5,Prefer glass jar,I am a marmite lover. I have switched back to the glass jar because 1. marmite isn't the right consistency to be squeezed and 2. the glass jar can be recycled.,False
2019-01-06,5,Great,Great,True
2019-01-06,5,Good,Thank you,True
2019-01-06,5,Good and has very good smelling clothes,I got this and it’s be a great buy. Don’t have to put much into wash and clean clothes at end of was the fragrance last long time too,True
2019-02-04,5,Good for sensitive skin,"I had been lured by all the enticing fragrances on other conditioners but noticed that my eyes would smart and my kids would ask why I seemed to be squinting my eyes. I'm now back to using Comfort Pure as I used it before with no reactions. Smells good, softens clothes, can't complain!",False
2019-01-06,5,"Strong, but pleasant, smell.","Gives a good result - the fragrance is very strong though and it lasts a long time. I really like it but if you don’t, you won’t really be able to still use the product as there is no avoiding it.",False
2019-01-06,5,"Strong, but pleasant, smell.","Gives a good result - the fragrance is very strong though and it lasts a long time. I really like it but if you don’t, you won’t really be able to still use the product as there is no avoiding it.",False
2019-01-06,5,"Strong, but pleasant, smell.","Gives a good result - the fragrance is very strong though and it lasts a long time. I really like it but if you don’t, you won’t really be able to still use the product as there is no avoiding it.",False
2019-01-06,5,Great,Great,True
2019-01-06,5,Very good,Good,True
2019-01-06,5,We love the smell,We love it and even better when it’s on a deal,True
2019-01-07,5,Excellent value,Good size spray,True
2019-01-06,5,A bargain price for the only shampoo I use,The price of this bulk pack is less than buying the items individually from somewhere else. I won't use any other shampoo because they tend to dry my hair and I don't like using a lot of chemicals. This product is perfect as it contains nothing and keeps me dandruff free. Even anti-dandruff shampoo doesn't always work I've found in the past.,True
2019-02-05,5,Stock cubes,Like to make my own soups & casseroles. This product does very well for that.,True
2019-01-07,5,Excellent value,Good size spray,True
2019-01-07,5,tasty and low calories,The best ice cream ever,False
2019-01-07,5,Excellent shampoo,I live in an extremely hard water area half the year. As soon as I'm here my hair becomes dry and the scalp sensitive...this is a great shampoo! Both my husband and I are a completely satisfied.,False
2019-01-08,5,Easy to use,Easy to use. I will recommend it if you want to get all glam up to go out somewhere this is the product to use,True
2019-01-07,1,Dissatisfied,Disappointed shows big conditioner but small arrived,True
2019-01-07,5,Good price,We all know how this works,True
2019-01-07,5,Good price,We all know how this works,True
2019-01-07,3,Price is good,Doesn’t clean my clothes too well and if there is too many clothes they won’t smell good other wise price is good,True
2019-01-07,3,Price is good,Doesn’t clean my clothes too well and if there is too many clothes they won’t smell good other wise price is good,True
2019-01-07,3,Price is good,Doesn’t clean my clothes too well and if there is too many clothes they won’t smell good other wise price is good,True
2019-01-07,3,Price is good,Doesn’t clean my clothes too well and if there is too many clothes they won’t smell good other wise price is good,True
2019-01-07,3,Price is good,Doesn’t clean my clothes too well and if there is too many clothes they won’t smell good other wise price is good,True
2019-01-08,5,Good value,I would recommend - good value,True
2019-01-08,5,,I will be buying again thank,True
2019-01-08,5,It is Lynx,What more is there to say,True
2019-01-08,5,Refreshing,Always been a fan of dove products. Antiperspirant effect lasts longer than any other product I've ever used before. Really gentle on skin and keeps me fresh all day long.,True
2019-01-08,5,Good,As expected - repeat purchase,True
2019-01-08,5,Value for money,Excellent value for money,True
